{"payloadSchema":"book-plan.r1","planningMaturity":"APPROVED","storyPromise":"promise","protagonistMacroDirection":"direction","endingBoundary":"boundary","mustAchieve":[],"mustNotBreak":[],"relationshipMacroDirections":[],"majorMysteryGoals":[],"futureReservations":[],"volumeIntentSeeds":[],"openingHypotheses":[],"globalLengthBudget":{"preferredWords":3000000}}
